{
  "id": "019a2b3c-4d5e-7f00-8a00-0000000000a1",
  "device_id": null,
  "owner_type": "checkpoint",
  "owner_id": "019a2b3c-4d5e-7f00-8a00-0000000000b1",
  "sha256": "a3f1c2d4e5b60718293a4b5c6d7e8f90a1b2c3d4e5f60718293a4b5c6d7e8f90",
  "mime": "image/jpeg",
  "size_bytes": 312456,
  "taken_at": "2026-10-27T21:03:44.120Z",
  "uploaded_at": "2026-10-27T21:10:00.000Z"
}
